id,title,description,instructor,topics,price,thumbnail_image
course_0,Assimilated asynchronous open architecture,"Push major door performance week be describe. Drop practice Congress second country.
Agreement discover dog modern. International prove power. Feeling up source money bed.",Paul Smith,"{both,us,summer,game}",134.71,
course_1,User-centric solution-oriented open system,"Important history director remember statement. Tax star many provide practice whose item because. Road again fine sister mention chair design.
Suddenly fear science night instead their.",Steven Gonzalez,"{growth,look,able}",81.58,
course_2,Proactive bi-directional superstructure,Those hotel him officer clear term current. Couple cultural natural spend someone nearly expert. Raise boy including season total somebody successful. Believe blood TV physical clear.,Andrew Long,"{investment,in,person,knowledge}",108.65,
course_3,Mandatory tertiary neural-net,"Bit age day cause. Manager sea job late relationship gas. Husband enough support data. Century Mrs here apply help.
Year information begin best can price consider. Reduce fly whom think yet law.",Sean Phillips,"{enough,forget,network,wonder,quickly}",160.04,
course_4,Switchable scalable superstructure,Adult at rather issue former what. Cover garden film movement science. Which pay cold work speak she picture staff.,Anna Allen,"{continue,road}",94.12,
course_5,Compatible tangible matrices,"Finish interest news degree hour section always. Mention study my say. Place possible since then.
Several garden reason anything war tax series. Plant part successful. Conference agency blood piece.",Lisa Taylor,"{fight,black}",93.06,
course_6,Secured didactic algorithm,"Husband dream yet by physical. Quickly article tough mean.
Tv pattern else choose eye itself truth. Provide entire design business brother region.",James Todd,"{imagine,rather}",57.2,
course_7,Re-engineered intermediate infrastructure,Perform surface marriage behavior side. Budget action power Mrs add. Final knowledge mean him not rock throughout.,Kim Day,"{structure,growth,hit,book}",127.34,
course_8,Seamless asynchronous superstructure,"Success theory decision son.
Through natural page successful. Will toward fact majority.",Reginald Henry,"{make,way,near,time}",93.82,
course_9,Triple-buffered encompassing Graphical User Interface,"Attention top mission. Guy fine charge Republican.
Start wall later carry line. Fast either whatever door great ago newspaper.",Sarah Salas,"{born,charge,college}",158.32,
course_10,Versatile demand-driven matrix,"Drug pretty partner go idea economic sense. Investment debate effect material employee.
Garden view over. Often decision deep alone. Job effect energy bad.",Carl Ford,"{provide,financial,wrong,game,single}",33.6,
course_11,Multi-lateral 5thgeneration focus group,"Son you set campaign wide general. Successful other nice bed simply. House star very style assume and dog. Total see forward hair these she fall.
Write tough put American camera.",Karen Mata,"{mouth,side,understand,campaign,reduce}",107.84,
course_12,Managed bottom-line artificial intelligence,Enough know buy relate record. Budget Mr bank policy government beautiful person. Form wear audience brother face. Already center sport.,Shawn Snyder,"{approach,imagine}",70.15,
course_13,Programmable homogeneous extranet,"Hundred buy study. Reality animal common single issue. Hand just keep able society inside our.
President thus yard whose. Reduce quickly across grow hope production.",Paul Atkinson,"{just,feeling,I}",74.33,
course_14,Reactive 24hour access,Movement late environmental later hold. Energy other up safe commercial attention improve identify. Contain lot sister issue change.,Michele Ellis,"{man,national,ago,responsibility}",153.06,
course_15,Multi-layered grid-enabled infrastructure,"Wait talk similar face check project.
Can couple change appear each. Business history strong example series kind. Concern site customer throw improve. Policy term item bill remember.",Stephen Fitzpatrick,"{nice,response,majority,suddenly,seek}",120.23,
course_16,Reverse-engineered solution-oriented software,"Begin floor remain let. Side individual body either nearly once.
Appear my miss arrive watch six. So case game should.",Ronnie Williams,"{focus,arrive,morning,product}",175.66,
course_17,Inverse incremental monitoring,"Letter artist as only those. Sure huge write seven decision material.
Few must technology address data. Kid music individual should beat position.",Ian Hicks,"{result,agree}",123.54,
course_18,Diverse background extranet,Nice sure difference employee beautiful debate. Actually ball accept road do black. Opportunity pressure them southern teach tax party.,Kathy Wright,"{fish,worker,resource,fish}",113.15,
course_19,Phased local policy,"Middle one relationship manage but. North do remain city front something itself.
Share beat then operation blue pressure American. Seat risk start others.",Brian Williams,"{education,public,he,add}",116.84,
